{
  "$schema": "../schema/combat-4.schema.json",
  "schemaVersion": 4,
  "player": {
    "startingHealth": 100,
    "maximumHealth": 200,
    "startingBullets": 50,
    "maximumBullets": 200,
    "startingWeapon": "pistol"
  },
  "weapons": [
    {
      "id": "pistol",
      "ammoPerShot": 1,
      "range": 2048,
      "autoAimAngleDegrees": 5.625,
      "autoAimMaximumSlope": 0.625,
      "damageMinimum": 5,
      "damageMaximum": 15,
      "damageStep": 5
    }
  ],
  "combatants": [
    {
      "actor": "zombieman",
      "health": 20,
      "radius": 20,
      "height": 56,
      "behavior": {
        "sightRange": 2048,
        "attackRange": 2048,
        "preferredRange": 96,
        "moveSpeed": 96,
        "reactionMilliseconds": 300,
        "attackIntervalMilliseconds": 1000,
        "damage": {
          "minimum": 3,
          "maximum": 15,
          "step": 3
        }
      }
    }
  ],
  "pickups": [
    { "actor": "ammunition-clip", "resource": "bullets", "amount": 10, "limit": 200, "radius": 20 },
    { "actor": "box-of-bullets", "resource": "bullets", "amount": 50, "limit": 200, "radius": 20 },
    { "actor": "stimpack", "resource": "health", "amount": 10, "limit": 100, "radius": 20 },
    { "actor": "medikit", "resource": "health", "amount": 25, "limit": 100, "radius": 20 },
    { "actor": "health-bonus", "resource": "health", "amount": 1, "limit": 200, "radius": 20 },
    { "actor": "soulsphere", "resource": "health", "amount": 100, "limit": 200, "radius": 20 }
  ]
}
